nct_id,brief_title,official_title,category,status,start_date,completion_date,sponsor,study_type,phase,enrollment,conditions
NCT05704361,"A Study to Investigate the Safety, Tolerability, and Processing by the Body of Intravenous and Subcutaneous RO7121932 Administration in Participants With Multiple Sclerosis","A Multiple-center, Non-randomized, Open-label, Adaptive, Single-ascending Dose (Part 1 and Part 2) and Multiple-ascending Dose (Part 3) Parallel, Phase IB Study to Investigate the Safety, Tolerability, Immunogenicity, Pharmacokinetics, and Pharmacodynamics of RO7121932 Following Intravenous (Parts 1) and Subcutaneous Administration (Parts 2 and 3) in Participants With Multiple Sclerosis",Autoimmune,RECRUITING,2021-08-11,2027-07-08,Hoffmann-La Roche,INTERVENTIONAL,PHASE1,129,Multiple Sclerosis
NCT04747080,The Combination of Tacrolimus and High-dose Dexamethasone as First-line Treatment in Adult Immune Thrombocytopenia,"The Combination of High-dose Dexamethasone and Tacrolimus Versus High-dose Dexamethasone as the First-Line Treatment of Newly-diagnosed Immune Thrombocytopenia: A Randomized, Controlled, Multicenter, Open-label Trial",Autoimmune,UNKNOWN,2021-03-01,2023-07-01,Peking University People's Hospital,INTERVENTIONAL,PHASE2,120,"ITP, Immune Thrombocytopenia"
NCT04880720,Deciphering a Specific Signature of the Immunosenescence Induced in COVID-19+ Patients Versus Rheumatoid Arthritis Patients,Deciphering a Specific Signature of the Immunosenescence Induced in COVID-19+ Patients Versus Rheumatoid Arthritis Patients,Autoimmune,COMPLETED,2021-07-19,2022-11-16,"University Hospital, Montpellier",OBSERVATIONAL,N/A,43,"SARS-Cov-2 Infection, Rheumatoid Arthritis"
NCT01614496,Rule-Based Closed Loop System for Type 1 Diabetes Control,,Autoimmune,COMPLETED,,,Corporacion Parc Tauli,INTERVENTIONAL,NA,0,Type 1 Diabetes
NCT01354288,Therapeutic Education in Very Young Children With Diabetes Mellitus,Therapeutic Education in Very Young Children With Diabetes Mellitus. Evaluation of the Impact of a Specific Tool for Parents on Glycemic Control and Prevention of Acute Events (Hypoglycemia and Ketosis),Autoimmune,COMPLETED,2011-12-07,2014-12-01,Assistance Publique - Hôpitaux de Paris,INTERVENTIONAL,NA,24,"Type 1 Diabetes, Diabetes Mellitus"
NCT02320188,Eccentric Exercise and Cachexia in Rheumatoid Arthritis,Effect of Eccentric Exercise Training in Rheumatoid Cachexia,Autoimmune,UNKNOWN,2014-12,2019-02-28,"University Hospital, Clermont-Ferrand",INTERVENTIONAL,NA,48,Rheumatoid Arthritis
NCT04007003,An Audit of the Impact of Tailored Information Delivered Via a Digital Learning Platform,An Audit of the Impact of Tailored Information Delivered Via a Digital Learning Platform,Autoimmune,TERMINATED,2018-06-26,2019-08-10,"Becton, Dickinson and Company",INTERVENTIONAL,NA,170,"Diabetes Mellitus, Type 2, Diabetes Mellitus, Type 1"
NCT02386527,Consortium of Early Arthritis Cohorts USA,Consortium of Early Arthritis Cohorts USA - A Prospective Cohort Study of Adults With New Consent Inflammatory Arthritis Symptoms to Understand Predictors of Optimal Outcomes,Autoimmune,TERMINATED,2014-12-01,2024-04,"Hospital for Special Surgery, New York",OBSERVATIONAL,N/A,119,Rheumatoid Arthritis
NCT05687890,A Study to Evaluate the Efficacy and Safety of SC0062 in the Treatment of Chronic Kidney Disease,"A Randomized, Double Blind, Placebo Parallel Controlled, 2 Cohorts, Multicenter Phase II Study to Investigate the Safety and Efficacy of SC0062 Capsule in Patients With Chronic Kidney Disease With Albuminuria",Autoimmune,ACTIVE_NOT_RECRUITING,2023-05-23,2025-04,"Biocity Biopharmaceutics Co., Ltd.",INTERVENTIONAL,PHASE2,255,"Diabetic Kidney Disease, IgA Nephropathy"
NCT05757713,Teplizumab in Pediatric Stage 2 Type 1 Diabetes,"Single Arm, Open-label Study to Assess the Safety and Pharmacokinetics of a 14-day Regimen of Teplizumab in Pediatric Stage 2 Type 1 Diabetes (Participants <8 Years of Age With at Least Two Autoantibodies and Dysglycemia)",Autoimmune,ACTIVE_NOT_RECRUITING,2023-07-25,2026-08-27,Sanofi,INTERVENTIONAL,PHASE4,20,"Diabetes Mellitus, Type 1"
NCT03776682,Myocardial Inflammation in Rheumatoid Arthritis: A Descriptive Study,Myocardial Inflammation in Rheumatoid Arthritis: A Descriptive Study,Autoimmune,COMPLETED,2018-06-22,2023-05-26,Mayo Clinic,OBSERVATIONAL,N/A,35,"Myocardial Inflammation, Rheumatoid Arthritis, Coronary Artery Disease, Myocardial Strain"
NCT01709123,Effects of Micronutrient (Chromium) Supplementation on Diabetes,"Ketosis, Vascular Inflammation, and Its Therapy (Chromium Supplementation) in Diabetic Patients",Autoimmune,COMPLETED,2007-08,2013-09,Louisiana State University Health Sciences Center Shreveport,INTERVENTIONAL,NA,62,"Diabetes Mellitus, Type 1"
NCT01135459,A Study to Evaluate the Efficacy and Safety of CEP-33457 in Participants With Systemic Lupus Erythematosus (SLE),"A Randomized, Double-Blind, Parallel-Group, Placebo-Controlled Study to Evaluate the Efficacy and Safety of a 200-mcg Dose of CEP-33457 in Patients With Systemic Lupus Erythematosus",Autoimmune,COMPLETED,2010-06-24,2012-06-30,"Cephalon, Inc.",INTERVENTIONAL,PHASE2,183,Systemic Lupus Erythematosus
NCT07472062,Development of a Non-Invasive Prognostic Test for Graves Orbitopathy,Development of a Non-Invasive Prognostic Test for Graves Orbitopathy,Autoimmune,ACTIVE_NOT_RECRUITING,2023-05-13,2026-12-31,"University Hospital, Ghent",INTERVENTIONAL,NA,90,"Graves Orbitopathy, Hyperthyroidism"
NCT04061746,Cellular Therapy for Type 1 Diabetes Using Mesenchymal Stem Cells,Cellular Therapy for Type 1 Diabetes Using Mesenchymal Stem Cells,Autoimmune,ACTIVE_NOT_RECRUITING,2020-02-27,2027-05-30,Medical University of South Carolina,INTERVENTIONAL,PHASE1,60,"Diabetes Mellitus, Type 1"
NCT06608797,Testing the Feasibility of Computer-based Cognitive Training in Individuals with Multiple Sclerosis Living in the Community,Testing the Feasibility of Computer-based Cognitive Training in Individuals with Multiple Sclerosis Living in the Community,Autoimmune,RECRUITING,2024-09-30,2025-12-31,Kessler Foundation,INTERVENTIONAL,NA,40,Multiple Sclerosis
NCT05933460,Crocus Sativus Extract Impact in Metabolic Control of Patients With Diabetes Mellitus Type 1,Investigation of the Impact of the Administration of Crocus Sativus L Extract on the Metabolic Control of Patients With Type 1 Diabetes Mellitus,Autoimmune,COMPLETED,2022-03-01,2023-04-28,Aristotle University Of Thessaloniki,INTERVENTIONAL,NA,61,"Diabetes Mellitus, Type 1, Diabetes type1"
NCT04806282,"Deep Phenotyping of Hearing Instability Disorders: Cohort Establishment, Biomarker Identification, Development of Novel Phenotyping Measures, and Discovery of Therapeutic Targets","Deep Phenotyping of Hearing Instability Disorders: Cohort Establishment, Biomarker Identification, Development of Novel Phenotyping Measures, and Discovery of Therapeutic Targets",Autoimmune,RECRUITING,2021-08-17,2030-12-31,National Institute on Deafness and Other Communication Disorders (NIDCD),OBSERVATIONAL,N/A,210,"Meniere's Disease, Enlarged Vestibular Aqueduct Syndrome, Autoimmune Inner Ear Disease"
NCT02227862,Non-inferiority Study to Compare the Efficacy and Safety of Mylan's Insulin Glargine With Lantus® in Type 1 Diabetes Mellitus Patients (INSTRIDE 1),"An Open-Label, Randomized, Multi-Center, Parallel-Group Clinical Trial Comparing the Efficacy and Safety of Mylan's Insulin Glargine With Lantus® in Type 1 Diabetes Mellitus Patients",Autoimmune,COMPLETED,2014-06,2016-07,Mylan Inc.,INTERVENTIONAL,PHASE3,558,Type 1 Diabetes
NCT01352858,Autologous Tolerogenic Dendritic Cells for Rheumatoid Arthritis (AutoDECRA),Phase 1 Study of Autologous Tolerogenic Dendritic Cells for Rheumatoid Arthritis,Autoimmune,COMPLETED,2012-02,2018-11,Newcastle University,INTERVENTIONAL,PHASE1,14,Rheumatoid Arthritis
NCT02831855,Methotrexate Withdrawal Study of Tofacitinib Modified Release Formulation in Subjects With Rheumatoid Arthritis,A PHASE 3B/4 RANDOMIZED DOUBLE BLIND PLACEBO CONTROLLED STUDY OF METHOTREXATE (MTX) WITHDRAWAL IN SUBJECTS WITH RHEUMATOID ARTHRITIS (RA) TREATED WITH TOFACITINIB 11MG MODIFIED RELEASE (MR) FORMULATION,Autoimmune,COMPLETED,2016-09-01,2018-12-17,Pfizer,INTERVENTIONAL,PHASE4,694,Rheumatoid Arthritis
NCT00464997,The Effect of Low Dose Aspirin on the Pharmacokinetics of Methotrexate,The Effect of Low Dose Aspirin on the Pharmacokinetics of Methotrexate,Autoimmune,UNKNOWN,2007-06,,Tel-Aviv Sourasky Medical Center,OBSERVATIONAL,N/A,30,Rheumatoid Arthritis
NCT00040482,High Dose Chemo/Radiotherapy and Hematopoietic Stem Cell Transplant for Patients With Multiple Sclerosis,"Intensive Immunosuppression Followed by Rescue With CD34 Selected, T Cell Depleted, Leukopheresis Products in Patients With Multiple Sclerosis",Autoimmune,COMPLETED,1999-04,2005-08,Baylor College of Medicine,INTERVENTIONAL,PHASE2,10,Multiple Sclerosis
NCT04218890,"TF, TFPI and Plasmin as Novel Bio-markers in Early Diagnosis of Lupus Nephritis","Urinary Tissue Factor (TF), Tissue Factor Pathway Inhibitor (TFPI) and Plasmin as Bio-markers in Early Diagnosis of Lupus Nephritis",Autoimmune,UNKNOWN,2020-04-01,2023-12-01,Assiut University,OBSERVATIONAL,N/A,100,Lupus Nephritis
NCT03878810,Exergaming in Persons With Multiple Sclerosis With Restless Legs Syndrome,Effects of Video Game-based Physical Activity Training in Persons With Multiple Sclerosis With Restless Legs Syndrome,Autoimmune,COMPLETED,2019-03-29,2021-12-15,Dokuz Eylul University,INTERVENTIONAL,NA,65,Multiple Sclerosis
NCT03177213,Serum IL-21 Levels in Patients With Pemphigus Vulgaris,Serum IL-21 Levels in Patients With Pemphigus Vulgaris,Autoimmune,UNKNOWN,2017-06,2018-12,Assiut University,OBSERVATIONAL,N/A,20,Pemphigus Vulgaris
NCT02405780,"A Study to Compare FKB327 Long-term Safety, Efficacy and Immunogenicity With Humira® in Rheumatoid Arthritis Patients","An Open-label Extension Study to Compare the Long-term Efficacy, Safety, Immunogenicity and Pharmacokinetics of FKB327 and Humira® in Patients With Rheumatoid Arthritis on Concomitant Methotrexate",Autoimmune,COMPLETED,2015-06-10,2018-01-18,"Fujifilm Kyowa Kirin Biologics Co., Ltd.",INTERVENTIONAL,PHASE3,645,"Arthritis, Rheumatoid"
NCT01148862,Assess the Efficacy of the Low Glucose Suspend (LGS) Feature in the MiniMed Paradigm® X54 System,"An In-clinic, Randomized, Cross-Over Study to Assess the Efficacy of the Low Glucose Suspend (LGS) Feature in the MiniMed Paradigm® X54 System With Hypoglycemic Induction From Exercise",Autoimmune,COMPLETED,2010-06,2011-11,"Medtronic MiniMed, Inc.",INTERVENTIONAL,NA,50,Type 1 Diabetes Mellitus
NCT04335513,Trial of Early Initiation of CGM-Guided Insulin Therapy in Stage 2 T1D,Trial of Early Initiation of CGM-Guided Insulin Therapy in Stage 2 T1D,Autoimmune,UNKNOWN,2020-04-30,2023-07-31,"University of Colorado, Denver",INTERVENTIONAL,NA,84,"Type 1 Diabetes, Prediabetic State, Dysglycemia, Autoimmune Diabetes"
NCT00579059,Maxim® Knee Pop-Top® Tibia vs. Regular Maxim® Knee Tibia,A Randomized Data Collection of the Maxim® Knee System With Removable Molded Polyethylene Tibia and the Regular Maxim® Knee System,Autoimmune,TERMINATED,2004-05,2007-11,"Biomet Orthopedics, LLC",INTERVENTIONAL,NA,31,"Osteoarthritis, Rheumatoid Arthritis, Traumatic Arthritis"
NCT03656562,Study the Efficacy and Safety of VAY736 and CFZ533 in SLE Patients,"A Placebo-controlled, Patient and Investigator Blinded, Randomized Parallel Cohort Study to Assess Pharmacodynamics, Pharmacokinetics, Safety, Tolerability and Preliminary Clinical Efficacy of VAY736 and CFZ533 in Patients With Systemic Lupus Erythematosus (SLE)",Autoimmune,COMPLETED,2018-12-19,2025-04-28,Novartis Pharmaceuticals,INTERVENTIONAL,PHASE2,107,Systemic Lupus Erythematosus (SLE)
NCT01439204,"Pharmacokinetic Study to Compare the Blood Levels of Abatacept Manufactured at Lonza Biologics to the Blood Levels of Abatacept Manufactured at the Devens, Massachusetts (MA) Facility of Bristol-Myers Squibb","A Randomized, Open-label, Parallel-Group, Single-dose, Biocomparability Study of the Pharmacokinetics of Abatacept (BMS-188667) Drug Products Using Active Pharmaceutical Ingredient Manufactured at Devens, MA Site Relative to Active Pharmaceutical Ingredient Manufactured at Lonza, New Hampshire (NH) in Healthy Subjects",Autoimmune,COMPLETED,2011-10,2012-02,Bristol-Myers Squibb,INTERVENTIONAL,PHASE1,223,Rheumatoid Arthritis
NCT06413043,Study on Efficacy of Add on Selenium in Mild-to-moderate Graves Ophthalmopathy,Study on Efficacy of Add on Selenium in Mild-to-moderate Graves Ophthalmopathy: A Randomized Control Trial,Autoimmune,UNKNOWN,2024-05-06,2025-11-05,"All India Institute of Medical Sciences, Bhubaneswar",INTERVENTIONAL,NA,78,"Thyroid Eye Disease, Graves Ophthalmopathy"
NCT06992115,A Study of the MIND Diet for Persons With Multiple Sclerosis,Randomized Controlled Trial of MIND Diet for Neuroprotection and Symptom Management in MS,Autoimmune,RECRUITING,2025-05-12,2029-04-30,Icahn School of Medicine at Mount Sinai,INTERVENTIONAL,NA,100,Multiple Sclerosis
NCT01454284,A Study in Participants With Type I Diabetes Mellitus,"The Impact of LY2605541 Versus Insulin Glargine for Patients With Type 1 Diabetes Mellitus Treated With Preprandial Insulin Lispro: a Double-Blind, Randomized, 52-week Study",Autoimmune,COMPLETED,2012-01,2014-02,Eli Lilly and Company,INTERVENTIONAL,PHASE3,1114,"Diabetes Mellitus, Type 1"
NCT00550355,Dose-Escalating Multiple Dose Study of PD-0360324 in Combination With Methotrexate in Patients With Rheumatoid Arthritis,"A Randomized, Subject and Investigator-Blind, Placebo-Controlled Study to Investigate the Safety, Tolerability, Pharmacokinetics and Pharmacodynamics of Multiple Intravenously Administered Doses of PD-0360324 in Patients With Rheumatoid Arthritis Receiving Methotrexate",Autoimmune,COMPLETED,2007-08,2009-06,Pfizer,INTERVENTIONAL,PHASE1,78,"Arthritis, Rheumatoid"
NCT04416243,Feasibility of a High-intensity Interval Training Program in Persons With Multiple Sclerosis Who Have Walking Disability,"A Single-group, Feasibility, and Initial Efficacy Study of a High-intensity Interval Training Program Using Adaptive Equipment in Persons With Multiple Sclerosis Who Have Walking Disability",Autoimmune,COMPLETED,2019-12-19,2022-12-14,"University of North Texas, Denton, TX",INTERVENTIONAL,NA,17,Multiple Sclerosis
NCT06652308,Mood Disorders in Multiple Sclerosis Patients,Frequency of Unipolar and Bipolar Mood Disorders in Patients with Multiple Sclerosis: a Retrospective Cohort Study,Autoimmune,COMPLETED,2024-07-01,2024-09-30,"Islamic Azad University, Sanandaj",OBSERVATIONAL,N/A,85,"Multiple Sclerosis (MS), Unipolar Depression, Bipolar Disorder, Mood Disorders"
NCT03699189,"ANAIS, a Spanish Version of the DAFNE Programme","Assessment of ANAIS (Alimentación Normal Con Ajuste de InSulina), a Spanish Version of the DAFNE (Dose Adjustment for Normal Eating) Programme, in Patients With Type 1 Diabetes: a Randomised, Controlled, Parallel Trial",Autoimmune,COMPLETED,2011-11,2015-02,Rosa María Sánchez Hernández,INTERVENTIONAL,NA,80,"Diabetes Mellitus, Type 1"
NCT01207648,Retrospective Cohort Study of Rebif® Use in Pediatric Multiple Sclerosis (MS) Subjects (REPLAY),Retrospective Cohort Study of Rebif® Use in Pediatric MS Patients,Autoimmune,COMPLETED,2010-07,2011-07,EMD Serono,OBSERVATIONAL,N/A,307,Multiple Sclerosis
NCT05447143,Effect of Home Exercise Program on Various Parameters in Patients With Multiple Sclerosis,Examination of the Effect of Home Exercise Program on Various Parameters in Patients With Multiple Sclerosis: A Randomized Controlled Single-Blind Trial,Autoimmune,COMPLETED,2021-09-30,2022-06-15,Muğla Sıtkı Koçman University,INTERVENTIONAL,NA,60,"Multiple Sclerosis, Exercise Program, Telerehabilitation, Autoimmune Disorder"
NCT00069615,Pilot Study of the GlucoWatch G2 Biographer for the Management of Type 1 Diabetes in Children,DirecNet Pilot Study to Evaluate the GlucoWatch G2 Biographer in the Management of Type 1 Diabetes in Children,Autoimmune,COMPLETED,2003-02,2003-06,Jaeb Center for Health Research,INTERVENTIONAL,PHASE4,15,"Diabetes Mellitus, Insulin-Dependent"
NCT05538208,The Pediatric Lupus Nephritis Mycophenolate Mofetil (PLUMM) Study,Efficacy & Safety of Pharmacokinetically-Driven Dosing of Mycophenolate Mofetil for the Treatment of Pediatric Proliferative Lupus Nephritis- A Double-Blind Placebo Controlled Clinical Trial,Autoimmune,RECRUITING,2024-06-07,2027-01,"Children's Hospital Medical Center, Cincinnati",INTERVENTIONAL,PHASE2,105,Lupus Nephritis
NCT03376789,Mylan Insulin Glargine Study,"A Randomized, Multi-center, Double-Blind, Parallel-Group Clinical Study Comparing the Efficacy and Safety of MYL-1501D Produced by Two Manufacturing Processes in Type 1 Diabetes Mellitus Patients",Autoimmune,COMPLETED,2017-11-29,2019-01-10,Mylan Inc.,INTERVENTIONAL,PHASE3,219,"Diabetes Mellitus, Type 1"
NCT04927468,Supramaximal Rectus Recession for Strabismus in Grave's Ophthalmopathy,The Management of Large-angle Strabismus in Grave's Ophthalmopathy With Supramaximal Rectus Recession,Autoimmune,UNKNOWN,2021-07-01,2023-07-01,Sun Yat-sen University,INTERVENTIONAL,NA,60,"Strabismus, Mechanical, Graves Ophthalmopathy"
NCT07596849,A Study to Assess Efficacy and Safety of Efgartigimod PH20 SC PFS in Adult Participants With Graves' Disease.,"A Phase 3, Randomized, Double-Masked, Placebo-Controlled, Multicenter Study Evaluating the Efficacy and Safety of Efgartigimod PH20 SC PFS in Adult Participants With Graves' Disease Inadequately Controlled With Antithyroid Drugs",Autoimmune,NOT_YET_RECRUITING,2026-06,2030-05,argenx,INTERVENTIONAL,PHASE3,230,Graves Disease
NCT01556685,"MATRIX: Measuring Neutralizing Antibodies in the Patients Treated With Interferon Beta 1a IM, in Mexico and Colombia","Measuring Neutralizing Antibodies in the Patients Treated With Interferon Beta 1a IM, in Mexico and Colombia",Autoimmune,COMPLETED,2011-03,,Biogen,INTERVENTIONAL,PHASE4,180,Multiple Sclerosis
NCT04049448,Study Evaluating the Long-Term Safety and Efficacy of ABX464 in Patients With Moderate to Severe Rheumatoid Arthritis,A Follow-up Phase 2a Open-label Study to Evaluate the Long-term Safety and Efficacy Profile of ABX464 in Patients With Moderate to Severe Active Rheumatoid Arthritis,Autoimmune,COMPLETED,2019-10-25,2023-01-23,Abivax S.A.,INTERVENTIONAL,PHASE2,40,Rheumatoid Arthritis
NCT07306585,"The Safety, Tolerability, Pharmacokinetics, Immunogenicity and Preliminary Efficacy of HC022 Injection in Subjects With SLE/CLE","A Multicenter, Randomized, Double-blind, Placebo-controlled Phase Ib Clinical Study to Evaluate the Safety, Tolerability, Pharmacokinetics, Immunogenicity Characteristics and Preliminary Efficacy of Multiple Ascending Doses of HC022 Injection in Subjects With Systemic Lupus Erythematosus and/or Cutaneous Lupus Erythematosus",Autoimmune,NOT_YET_RECRUITING,2025-12-30,2027-09-24,HC Biopharma Inc.,INTERVENTIONAL,PHASE1,32,"Systemic Lupus Erythematosus (SLE), Cutaneous Lupus Erythematosus (CLE)"
NCT04510350,Investigation of Novel Immunological Biomarkers by Mass Cytometry in Patients With Early Multiple Sclerosis (CISCO),Investigation of Novel Immunological Biomarkers by Mass Cytometry in Patients With Early Multiple Sclerosis (CISCO),Autoimmune,COMPLETED,2020-02-19,2022-03-02,Rennes University Hospital,OBSERVATIONAL,N/A,90,Multiple Sclerosis
NCT01749943,Validation of Hand Held Dynamometer for Assessment of Lower Limb Muscle Strength in Multiple Sclerosis,Validation of a Hand-Held Dynamometer for Assessment of Lower Limb Muscle Strength in Multiple Sclerosis: Protocol for Strength Testing and Reliability Characteristics,Autoimmune,COMPLETED,2012-07,2013-07,"Brown, Theodore R., M.D., MPH",OBSERVATIONAL,N/A,21,Multiple Sclerosis
NCT03245515,A Study of BMS-986195 in Healthy Male Subjects,Pharmacokinetics and Metabolism of [14C] BMS-986195 in Healthy Male Subjects,Autoimmune,COMPLETED,2017-08-15,2017-10-05,Bristol-Myers Squibb,INTERVENTIONAL,PHASE1,24,Rheumatoid Arthritis
NCT01751776,"Safety, Tolerability, Pharmacokinetics, Pharmacodynamics and Clinical Effects of Multiple Rising Subcutaneous Doses of BI 655064 in Healthy Volunteers and in Rheumatoid Arthritis Patients With Prior Inadequate Response to Methotrexate Therapy","A Randomised, Double-blind, Placebo-controlled Trial for Establishing Safety, Tolerability, Pharmacokinetics, Pharmacodynamics and Clinical Efficacy of Multiple Subcutaneous Doses of BI 655064 in Healthy Volunteers and in Rheumatoid Arthritis Patients With Prior Inadequate Response to Methotrexate Therapy",Autoimmune,COMPLETED,2012-12-18,2015-04-27,Boehringer Ingelheim,INTERVENTIONAL,PHASE1,107,"Arthritis, Rheumatoid, Healthy"
NCT05054140,"Study to Evaluate Efficacy, Safety, and Tolerability of IMU-838 in Patients With Progressive Multiple Sclerosis","Multicenter, Randomized, Double-blind, Placebo-controlled Study to Evaluate Efficacy, Safety, and Tolerability of IMU-838 in Patients With Progressive Multiple Sclerosis",Autoimmune,UNKNOWN,2021-09-30,2025-01-07,Immunic AG,INTERVENTIONAL,PHASE2,450,Multiple Sclerosis
NCT00100178,New Onset of Type 1 Diabetes Mycophenolate Mofetil-Daclizumab Clinical Trial,New Onset of Type 1 Diabetes Mycophenolate Mofetil-Daclizumab Clinical Trial (Preservation of Pancreatic Production of Insulin Through Immunosuppression-POPPII #1),Autoimmune,COMPLETED,2004-05,2008-04,National Institute of Diabetes and Digestive and Kidney Diseases (NIDDK),INTERVENTIONAL,PHASE2,126,"Diabetes Mellitus, Type 1"
NCT01509989,International Prospective Study on Adherence to Treatment in Patients With Active Systemic Lupus Erythematosus,International Prospective Study on Adherence to Treatment in Patients With Active Systemic Lupus Erythematosus,Autoimmune,COMPLETED,2013-01,2016-03,Assistance Publique - Hôpitaux de Paris,OBSERVATIONAL,N/A,307,Systemic Lupus Erythematosus
NCT04783935,Extension to the MAGNIFY MS Trial on Mavenclad® (Magnify MS Extension),A 2-year Extension Study to Evaluate Long-term Effectiveness of Mavenclad® in Participants Who Have Completed Trial MS700568_0022 (MAGNIFY MS) (Magnify MS Extension),Autoimmune,COMPLETED,2021-03-10,2023-09-21,"Merck Healthcare KGaA, Darmstadt, Germany, an affiliate of Merck KGaA, Darmstadt, Germany",INTERVENTIONAL,PHASE4,219,Multiple Sclerosis
NCT02794285,Long Term Safety of Anifrolumab in Adult Subjects With Active Systemic Lupus Erythematosus,"A Multicentre, Randomised, Double-blind, Placebo-Controlled Phase 3 Extension Study to Characterise the Long-term Safety and Tolerability of Anifrolumab in Adult Subjects With Active Systemic Lupus Erythematosus.",Autoimmune,COMPLETED,2016-06-30,2021-12-21,AstraZeneca,INTERVENTIONAL,PHASE3,559,Active Systemic Lupus Erythematosus
NCT06894940,Rehabilitative Protocols in Progressive Multiple Sclerosis Treated with Anti CD20 Monoclonal Antibodies,Rehabilitation of the Upper Limb in Progressive Multiple Sclerosis: a Clinical and MRI Study of Different Rehabilitative Protocols in Patients Treated with Anti B Monoclonal Antibodies,Autoimmune,COMPLETED,2021-06-01,2024-11-30,University of Pavia,INTERVENTIONAL,PHASE2,82,Multiple Sclerosis
NCT01339455,Autologous Hematopoietic Stem Cell Transplant in Neuromyelitis Optica,Autologous Hematopoietic Stem Cell Transplant in Patients With Neuromyelitis Optica,Autoimmune,TERMINATED,2011-03,2017-03,University of Calgary,INTERVENTIONAL,"PHASE1, PHASE2",3,Neuromyelitis Optica
NCT03384485,Prevalence of Lysosomal Hydrolase Alpha-glagtosidase Deficiency in Patients With Antiphospholipid Syndrome.,Prevalence of Lysosomal Hydrolase Alpha-glagtosidase Deficiency in Patients,Autoimmune,UNKNOWN,2018-02-01,2018-10-01,Meir Medical Center,INTERVENTIONAL,NA,100,Antiphospholipid Syndrome
NCT01112215,Enteric-coated Mycophenolate Sodium Versus Azathioprine for the Extra-renal Lupus Manifestations,Randomized Controlled Trial to Evaluate the Efficacy of Enteric-coated Mycophenolate Sodium Versus Azathioprine for the Induction and Maintenance of Remission of the Extra-renal Lupus Manifestations,Autoimmune,COMPLETED,2009-12,2015-12,Hospital Universitari Vall d'Hebron Research Institute,INTERVENTIONAL,PHASE4,240,Systemic Lupus Erythematosus
NCT00706017,Observational Study to Evaluate the Safety of Levemir® in Diabetes,"Observational, Safety Study in Subjects Using Levemir® (Insulin Detemir) for the Treatment of Insulin Dependent Type 1 or Type 2 Diabetes Mellitus",Autoimmune,COMPLETED,2007-09,2008-07,Novo Nordisk A/S,OBSERVATIONAL,N/A,2282,"Diabetes, Diabetes Mellitus, Type 1, Diabetes Mellitus, Type 2"
NCT03845517,A DOSE-RANGING STUDY TO EVALUATE EFFICACY AND SAFETY OF PF-06700841 IN SYSTEMIC LUPUS ERYTHEMATOSUS (SLE),"A PHASE 2B, DOUBLE-BLIND, RANDOMIZED, PLACEBO-CONTROLLED, MULTICENTER, DOSE-RANGING STUDY TO EVALUATE THE EFFICACY AND SAFETY PROFILE OF PF-06700841 IN PARTICIPANTS WITH ACTIVE SYSTEMIC LUPUS ERYTHEMATOSUS (SLE)",Autoimmune,COMPLETED,2019-04-18,2023-10-05,Pfizer,INTERVENTIONAL,PHASE2,350,Systemic Lupus Erythematosus
NCT02433340,"Phase 2, Multicenter, Open-Label Extension Study With ABT-122 in Rheumatoid Arthritis Subjects Who Have Completed the Preceding M12-963 Study","Phase 2, Multicenter, Open-Label Extension (OLE) Study With ABT-122 in Rheumatoid Arthritis Subjects Who Have Completed the Preceding M12-963 Phase 2 Randomized Controlled Trial (RCT)",Autoimmune,COMPLETED,2015-04,2016-05,AbbVie,INTERVENTIONAL,PHASE2,158,Rheumatoid Arthritis
NCT02326935,Multi-Center Study Safety of Adipose Derived Mesenchymal Stem Cells for the Treatment of Multiple Sclerosis,"Proposal for a Non-randomized, Patient Sponsored, Multi-center Study Studying the Impact and Safety of the Utilization of Culture Expanded Autologous, Adipose-derived Mesenchymal Stem Cells Deployed Via Intravenous Injection for the Treatment of Multiple Sclerosis",Autoimmune,TERMINATED,2014-11,2018-05-18,American CryoStem Corporation,INTERVENTIONAL,PHASE1,2,Multiple Sclerosis
