nct_id,brief_title,official_title,category,status,start_date,completion_date,sponsor,study_type,phase,enrollment,conditions
NCT00504764,Treatment of Relapsed Promyelocytic Leukemia With Arsenic Trioxide (ATO),APL-R2007: Treatment of Relapsed Promyelocytic Leukemia With Arsenic Trioxide (ATO),Oncology,COMPLETED,2007-07,2014-10,PETHEMA Foundation,INTERVENTIONAL,PHASE4,60,Acute Promyelocytic Leukemia
NCT04604964,Risk Factors for Anatomic Leakage in Advanced Ovarian Cancer Surgery,Risk Factors for Anastomotic Leakage in Advanced Ovarian Cancer Surgery: A Large Single Centre Experience,Oncology,COMPLETED,2011-12,2020-09,Catholic University of the Sacred Heart,OBSERVATIONAL,N/A,515,Intestinal Anastomotic Leak
NCT05302609,Evaluation of SclerFIX Graft in Scleral Thinning After Exeresis of Tumors of the Ocular Surface,Phase II Study: Evaluation of SclerFIX Graft in Scleral Thinning After Exeresis of Tumors of the Ocular Surface,Oncology,TERMINATED,2022-07-04,2024-02-21,TBF Genie Tissulaire,INTERVENTIONAL,PHASE2,17,Scleral Thinning
NCT02971709,Use of Shade in U.S. and Australian City Parks,Norms and Built Environment: Use of Shade in U.S. and Australian City Parks,Oncology,COMPLETED,2010-07,2017-05-31,"Klein Buendel, Inc.",INTERVENTIONAL,NA,144,Skin Cancer
NCT00899509,Gene Expression Profiling and Genetic Analysis of Tissues From Patients With Breast Cancer,"Correlative Studies of ERBB-2/HER-2/NEU and p53 in CALGB Protocol 9344/INT Protocol 0148: Doxorubicin Dose Escalation, With or Without Taxol®, as Part of the CA Adjuvant Chemotherapy Regimen For Node Positive Breast Cancer: A Phase III Intergroup Study",Oncology,COMPLETED,2000-10,2011-02,Alliance for Clinical Trials in Oncology,OBSERVATIONAL,N/A,1500,Breast Cancer
NCT05690009,Real Clinical Practice Register of AlbUminuRia Detection in Patients With Previously undiAgnosed Chronic Kidney Disease,Real Clinical Practice Register of AlbUminuRia Detection in Patients With Previously undiAgnosed Chronic Kidney Disease,Oncology,COMPLETED,2023-02-27,2024-04-01,Eurasian Association of Therapists,OBSERVATIONAL,N/A,4580,"Chronic Kidney Diseases, Hypertension, Chronic Heart Failure, Ischemic Heart Disease, Atrial Fibrillation, PreDiabetes, Chronic Obstructive Pulmonary Disease, Cancer, Urolithiasis, COVID-19"
NCT00417209,Larotaxel Compared To Continuous Administration of 5-FU in Advanced Pancreatic Cancer Patients Previously Treated With A Gemcitabine-Containing Regimen,"A Randomized, Open Label Multi-Center Study Of Single Agent Larotaxel (XRP9881) Compared To Continuous Administration of 5-FU For The Treatment Of Patients With Advanced Pancreatic Cancer Previously Treated With A Gemcitabine-Containing Regimen",Oncology,COMPLETED,2006-12,2009-11,Sanofi,INTERVENTIONAL,PHASE3,408,Pancreatic Neoplasms
NCT04234399,"Determination of the Diagnostic Detection Rate of Axumin (Fluciclovine) Digital PET/CT, Post-prostatectomy","Determination of the Diagnostic Detection Rate of Axumin (Fluciclovine) PET/CT Utilizing the High Resolution Digital Philips Vereos Scanner, in Patients With Biochemical Recurrence After Radical Prostatectomy",Oncology,TERMINATED,2020-03-01,2024-01-01,University of Vermont,OBSERVATIONAL,N/A,22,Prostatic Neoplasm
NCT05634499,A Study of Giredestrant in Participants With Grade 1 Endometrial Cancer,"A Phase II, Single-Arm Study of Giredestrant in Patients With Grade 1 Endometrial Cancer",Oncology,ACTIVE_NOT_RECRUITING,2023-06-27,2026-08-28,Hoffmann-La Roche,INTERVENTIONAL,PHASE2,30,Endometrial Cancer
NCT04877899,Mazankowski Alberta Heart Institute (MAHI) EchoGo Discovery 1 Protocol,Mazankowski - Echo Go Discovery Protocol Retrospective LVEF/GLS Comparison,Oncology,UNKNOWN,2020-10-08,2021-11-30,Ultromics Ltd,OBSERVATIONAL,N/A,250,"Cardiotoxicity, Cancer"
NCT02260544,Bioequivalence Study of Doxorubicin Hydrochloride Liposome Injection,"A Multicenter, Open Label, Balanced, Randomized, Two-treatment, Two-period, Two-sequence, Single Dose, Cross-over Bioequivalence Study of Doxorubicin Hydrochloride Liposome Injection 20mg/10mL of Dr. Reddy's Laboratories Ltd, India, With That of Doxorubicin Hydrochloride Liposome Injection 20 mg/10mL , Manufactured by: Sun Pharmaceutical Ind. Ltd, India; in Ovarian Cancer Patients Whose Disease Has Progressed or Recurred After Platinum Based Chemotherapy and Who Are Already Receiving or Scheduled to Start Therapy With the Reference Listed Drug Under Fasting Condition.",Oncology,COMPLETED,2014-07,2015-08,Dr. Reddy's Laboratories Limited,INTERVENTIONAL,PHASE1,49,Ovarian Epithelial Cancer Recurrent
NCT02754544,Electrocorticography in Mapping Functional Brain Areas During Surgery in Patients With Brain Tumors,Pilot Investigation of Using Electrocorticogram (ECoG) in Predicting Eloquent Cortex and Post-Operative Functional Outcomes in Patients With Brain Tumors,Oncology,RECRUITING,2016-07-22,2028-01-01,M.D. Anderson Cancer Center,INTERVENTIONAL,NA,75,"Brain Neoplasm, Metastatic Malignant Neoplasm in the Brain, Recurrent Brain Neoplasm"
NCT05431244,Pilot Study of Antiviral Treatment in Combination With Low-dose Gemcitabine in EBV-associated Gastric Cancer (EBVaGC),Pilot Study of Antiviral Treatment in Combination With Low-dose Gemcitabine in EBV-associated Gastric Cancer (EBVaGC),Oncology,WITHDRAWN,2022-07-01,2024-07-01,Samsung Medical Center,INTERVENTIONAL,NA,0,Gastric Cancer
NCT01096134,Mother - Daughter Initiative (MDI) in Cervical Cancer Prevention,Mother - Daughter Initiative (MDI) in Cervical Cancer Prevention,Oncology,COMPLETED,2011-01,2012-11,Jhpiego,INTERVENTIONAL,NA,8000,Cervical Cancer
NCT06575699,Rectus Sheath Block for Analgesia After Gynecological Laparotomy,Rectus Sheath Block With Liposomal Bupivacaine for Postoperative Analgesia Following Gynecologic Oncology Surgery: A Pilot Study,Oncology,COMPLETED,2024-10-10,2025-11-28,Duke University,INTERVENTIONAL,PHASE4,90,Gynecologic Surgical Procedures
NCT02979899,Trial of TRC105 and Pazopanib Versus Pazopanib Alone in Patients With Advanced Angiosarcoma,A Randomized Phase 3 Trial of TRC105 and Pazopanib Versus Pazopanib Alone in Patients With Advanced Angiosarcoma (TAPPAS),Oncology,COMPLETED,2017-02-13,2019-08-31,Tracon Pharmaceuticals Inc.,INTERVENTIONAL,PHASE3,128,Advanced Angiosarcoma
NCT04736199,Darolutamide in Addition to ADT Versus ADT in Metastatic Hormone-sensitive Prostate Cancer,"A Randomized, Double-blind, Placebo-controlled Phase 3 Study of Darolutamide in Addition to Androgen Deprivation Therapy (ADT) Versus Placebo Plus ADT in Men With Metastatic Hormone-sensitive Prostate Cancer (mHSPC)",Oncology,COMPLETED,2021-02-23,2026-01-23,Bayer,INTERVENTIONAL,PHASE3,669,Prostatic Neoplasms
NCT03391232,PolyPEPI1018 Vaccine and CDx for the Treatment of Metastatic Colorectal Cancer (OBERTO),"Safety, Tolerability, Immunogenicity and Efficacy of Multiple PolyPEPI1018 Vaccinations as an Add-on Immunotherapy to the Standard-of-Care Maintenance Therapy in Subjects With Metastatic Colorectal Cancer",Oncology,COMPLETED,2018-05-03,2019-07-17,Treos Bio Zrt,INTERVENTIONAL,"PHASE1, PHASE2",11,Colorectal Cancer
NCT04740398,A Study of CBP-1008 in Patients With Advanced Solid Tumor,"A Phase Ia/Ib, Open-Label, Multi-center, First in Human and Expansion Study to Assess the Safety, Tolerance, and Pharmacokinetics of the Novel Antitumor Agent CBP-1008 in Patients With Advanced Solid Tumors",Oncology,RECRUITING,2019-03-06,2024-09,"Coherent Biopharma (Suzhou) Co., Ltd.",INTERVENTIONAL,PHASE1,143,Advanced Solid Tumor
NCT06017063,Coaching for Coping in Glioblastoma Patients and Caregivers and Its Association With Compliance to TTFields,Coaching for Coping in Glioblastoma Patients and Caregivers and Its Association With Compliance to TTFields,Oncology,NOT_YET_RECRUITING,2023-10,2026-09,University Hospital Tuebingen,INTERVENTIONAL,NA,275,"Compliance, Patient, Glioblastoma, Astrocytoma, Grade IV"
NCT04783363,"Study Comparing Satisfaction of Hospitalized Patients Receiving Invasive Care for Cancer Treatment, With Snoezelen Session Versus Standard Care","Study Comparing Satisfaction of Hospitalized Patients Receiving Invasive Care for Cancer Treatment, With Snoezelen Session Versus Standard Care (SNOEZELEN)",Oncology,COMPLETED,2021-04-12,2023-09-18,Institut de cancérologie Strasbourg Europe,INTERVENTIONAL,NA,60,Cancer
NCT00241163,TachoComb S Versus Standard Surgical Treatment in Surgical Resection of Renal Tumour (TC-015-IN),"An Open, Randomised, Prospective, Multicentre, Parallel-group Trial to Compare Efficacy and Safety of TachoComb S Versus Standard Surgical Treatment in Patients Undergoing Surgical Resection of Superficial Renal Tumour.",Oncology,COMPLETED,,,Takeda,INTERVENTIONAL,PHASE3,170,Surgical Resection of Superficial Renal Tumour
NCT03030287,"A Phase 1b Study of OMP-305B83 Plus Paclitaxel in Subjects With Ovarian, Peritoneal or Fallopian Tube Cancer","A Phase 1b Study of OMP-305B83 Plus Weekly Paclitaxel in Subjects With Platinum Resistant Ovarian, Primary Peritoneal or Fallopian Tube Cancer",Oncology,COMPLETED,2016-12,2020-04,"OncoMed Pharmaceuticals, Inc.",INTERVENTIONAL,PHASE1,44,"Cancer Ovaries, Cancer Peritoneal, Cancer, Fallopian Tube"
NCT06564493,"A Prospective, Open-label, Randomized Controlled, Multicenter Clinical Study of MSD-HSCT Using a TBI or TMLI Conditioning Regimen for Pediatric ALL","A Prospective, Open-label, Randomized Controlled, Multicenter Clinical Study of Matched Sibling Donor Hematopoietic Stem Cell Transplantation Using a TBI or TMLI Conditioning Regimen for Pediatric Lymphoblastic Leukemia",Oncology,RECRUITING,2025-03-01,2029-12-31,The First Affiliated Hospital of Zhengzhou University,INTERVENTIONAL,PHASE2,170,"Acute Lymphoblastic Leukemia, Pediatric"
NCT00831493,Vorinostat Plus Radiation Therapy in Pancreatic Cancer,Phase I/II Trial of Vorinostat and Radiation Therapy in Patients With Locally Advanced Pancreatic Cancer,Oncology,TERMINATED,2009-05,2010-10,M.D. Anderson Cancer Center,INTERVENTIONAL,"PHASE1, PHASE2",3,Pancreatic Cancer
NCT00236093,Extension Study of ACTIQ Treatment for Children and Adolescents With Breakthrough Pain,"A 4-week, Open-Label Extension Study of ACTIQ (Oral Transmucosal Fentanyl Citrate [OTFC]) Treatment for Opioid-Tolerant Children and Adolescents With Breakthrough Pain",Oncology,COMPLETED,2006-10,,Cephalon,INTERVENTIONAL,PHASE2,0,"Pain, Cancer, Sickle Cell Anemia, Severe Burns"
NCT05903521,BAriatric Surgery Induced Chromosomal Change,Long-term Impact of Surgically Induced Rapid Weight Loss on Telomere Length and Its Potential Implications in the Genesis and Prevention of Neoplastic Disease Processes in Subjects With Severe Obesity,Oncology,TERMINATED,2023-06-12,2025-01-20,The Cleveland Clinic,OBSERVATIONAL,N/A,120,"Obesity, Morbid"
NCT00100321,Surgery for Pancreatic Tumors and Collection of Tumor Tissue for Study,Immunologic Studies of Tumors of the Pancreas,Oncology,TERMINATED,2004-12-21,2012-11-20,National Cancer Institute (NCI),OBSERVATIONAL,N/A,25,Pancreatic Neoplasms
NCT03901404,"Myomectomy Operation and Fundus Incision, Energy Modalities and Methods of Extraction","Used During Myomectomy Operation; Comparison of Fundus Incision, Energy Modalities and Methods of Extraction",Oncology,COMPLETED,2019-04-01,2022-04-01,Kanuni Sultan Suleyman Training and Research Hospital,OBSERVATIONAL,N/A,80,"Myoma;Uterus, Surgery"
NCT00523484,Casodex/Zoladex Hormonal therApy Study for assessMent of Correlation Between PSA & BAI in prOstate Cancer patieNts,An Observational Study to Assess Correlation Between Prostate Specific Antigen & Beck Anxiety Index in Prostate Cancer Patients Under Hormonal Therapy,Oncology,COMPLETED,2007-05,,AstraZeneca,OBSERVATIONAL,N/A,1200,Prostate Cancer
NCT02864784,"Investigating the Safety, Tolerability and Efficacy of Amorphous Calcium Carbonate (ACC) on the Treatment of Subjects With CRPC","A Prospective, Multicenter, Randomized, Placebo-Controlled, Two-armed, Double-blind Pilot Study to Evaluate the Safety, Tolerability and Efficacy of ACC vs. Placebo for the Treatment of Subjects With Castrate Resistant Prostate Cancer With Bone Metastasis",Oncology,WITHDRAWN,2022-06,2023-12,Amorphical Ltd.,INTERVENTIONAL,PHASE1,0,Castrate Resistant Prostate Cancer With Bone Metastasis
NCT06633133,Virtual Ileostomy Versus Diverting Ileostomy in Patients Undergoing Total Mesorectal Excision,"Comparing the Safety and Efficacy of Virtual Ileostomy Versus Diverting Ileostomy in Patients Undergoing Total Mesorectal Excision for Rectal Cancer: a Multicentre, Prospective, Open-label, Blinded Endpoint, PROBE Study",Oncology,RECRUITING,2024-10-10,2030-10-01,Daping Hospital and the Research Institute of Surgery of the Third Military Medical University,INTERVENTIONAL,NA,620,Rectal Cancer
NCT03602833,Phase I Study Compound 451238 and Radiotherapy in Soft-tissue Sarcoma,Compound 451238 and Radiotherapy in Soft-tissue Sarcoma,Oncology,COMPLETED,2018-11-05,2023-06-30,Royal Marsden NHS Foundation Trust,INTERVENTIONAL,"PHASE1, PHASE2",12,Soft-tissue Sarcoma
NCT00564733,FDG-Labeled PET Scan in Planning Chemotherapy in Treating Patients With Stage IIIB or IV Non-Small Cell Lung Cancer,FDG-PET Based Chemotherapy Selection for Metastatic Non-Small Cell Lung Cancer,Oncology,COMPLETED,2007-10,2012-03,University of Washington,INTERVENTIONAL,PHASE2,55,"Malignant Pleural Effusion, Stage IIIB Non-small Cell Lung Cancer, Stage IV Non-small Cell Lung Cancer"
NCT07019233,A Study of the Effect of Real-time Pressure Controllers on Subjective and Objective Symptoms of Peripheral Neuropathy Induced by Albumin Paclitaxel,Effect of Real-time Pressure Controllers on Objective and Subjective Symptoms of Albumin Paclitaxel-induced Peripheral Neuropathy: a Prospective Controlled Research Project,Oncology,RECRUITING,2024-09-01,2026-12-31,Tianjin Medical University Cancer Institute and Hospital,INTERVENTIONAL,NA,118,"Real Time Pressure Controller, Breast Cancer, Albumin Paclitaxel, Peripheral Neuropathy"
NCT03160833,A Study of HMPL-453 in Patients With Advanced Solid Malignancies,"A Phase I/II, Open-label, Multi-center, Dose Escalation Study to Assess the Safety, Tolerability, Pharmacokinetics and Preliminary Anti-tumor Activity of HMPL-453 in Patients With Advanced Solid Malignancies",Oncology,UNKNOWN,2017-05-23,2020-06-30,Hutchison Medipharma Limited,INTERVENTIONAL,"PHASE1, PHASE2",33,"Solid Tumor, Adult"
NCT02852252,Solid Tumor Cancer Surgery With or Without Intraoperative Imaging: A Registry,Solid Tumor Cancer Surgery With or Without Intraoperative Imaging: A Registry Optional Sub-Study I: ICG Optional Sub-Study II: OTL38,Oncology,COMPLETED,2016-07,2020-02,University of Pennsylvania,OBSERVATIONAL,N/A,291,"Bladder Cancer, Gastric Cancer"
NCT02705352,5-fluorouracil Versus Placebo in Periocular Full Thickness Skin Grafts,"A Prospective, Randomized, Double-blinded Comparison of the Use of 5-fluorouracil Versus Placebo in Periocular Full Thickness Skin Grafts.",Oncology,COMPLETED,2016-08-25,2019-01-25,Massachusetts Eye and Ear Infirmary,INTERVENTIONAL,PHASE2,1,"Ectropion, Skin Neoplasms"
NCT03326752,Phase 1b DV281 With an Anti-PD-1 Inhibitor in NSCLC,Phase 1b Dose Escalation and Dose Expansion Trial of DV281 in Combination With an Approved Anti-PD-1 Inhibitor in Subjects With Advanced Non-Small Cell Lung Cancer,Oncology,COMPLETED,2017-09-20,2019-09-19,Dynavax Technologies Corporation,INTERVENTIONAL,PHASE1,26,Advanced Non Small Cell Lung Cancer
NCT04279847,Safety and Tolerability Study of INCB057643 in Participants With Myelofibrosis and Other Advanced Myeloid Neoplasms,"A Phase 1, Open-Label, Safety and Tolerability Study of INCB057643 in Participants With Myelofibrosis and Other Advanced Myeloid Neoplasms",Oncology,ACTIVE_NOT_RECRUITING,2021-02-23,2027-04-30,Incyte Corporation,INTERVENTIONAL,PHASE1,140,"Myelofibrosis, Myelodysplastic Syndrome, Myelodysplastic/Myeloproliferative Neoplasm Overlap Syndrome, Myeloproliferative Neoplasm, Relapsed or Refractory Primary Myelofibrosis, Secondary Myelofibrosis (Post-Polycythemia Vera Myelofibrosis, Post-Essential Thrombocythemia Myelofibrosis), ET (Essential Thrombocythemia)"
NCT06627647,A Global Phase III Study of Rilvegostomig or Pembrolizumab Plus Chemotherapy for First-Line Treatment of Metastatic Non-squamous NSCLC,"A Phase III, Randomized, Double-blind, Multicenter, Global Study of Rilvegostomig or Pembrolizumab in Combination With Platinum-based Chemotherapy for the First-line Treatment of Patients With Metastatic Non-squamous Non-small Cell Lung Cancer Whose Tumors Express PD-L1 (ARTEMIDE-Lung03)",Oncology,RECRUITING,2024-11-27,2030-03-25,AstraZeneca,INTERVENTIONAL,PHASE3,878,Non-squamous Non-small Cell Lung Cancer
NCT05236049,Use of an Allograft Set-up (SclerFIX) as Replacement of Sclera Graft for Support of Enucleation Implant,Evaluation of Safety and Efficacy of Wrapping Orbital Implant by SclerFIX Product After Eye Enucleation,Oncology,COMPLETED,2019-07-01,2022-04-27,TBF Genie Tissulaire,INTERVENTIONAL,PHASE1,12,"Enucleated; Eye, Eye Cancer"
NCT05027347,Detection of Plasma Circulating Tumor DNA in Gastric Cancer,Detection of Plasma Circulating Tumor DNA in Gastric Cancer,Oncology,UNKNOWN,2021-10-10,2023-09-30,University Medical Center Ho Chi Minh City (UMC),OBSERVATIONAL,N/A,200,"Circulating Tumor DNA (ctDNA), Gastric Cancer"
NCT04220749,Radiotherapy vs. Trans-Oral Surgery for HPV-Negative Oropharyngeal Squamous Cell Carcinoma,A Phase II Randomized Trial for HPV-Negative Oropharyngeal Squamous Cell Carcinoma: Radiotherapy vs. Trans-Oral Surgery (ORATOR),Oncology,RECRUITING,2020-06-25,2028-02,London Health Sciences Centre Research Institute OR Lawson Research Institute of St. Joseph's,INTERVENTIONAL,PHASE2,68,"Head and Neck Cancer, Oropharyngeal Squamous Cell Carcinoma"
NCT04883749,Efficacy of Acalabrutinib in Very Old or Frail Patients With Treatment-naïve or Relapsed/Refractory CLL,"CLL-Frail - A Prospective, Multicenter Phase II Trial of Acalabrutinib in Very Old (≥80y) or Frail CLL-Patients",Oncology,COMPLETED,2021-06-01,2025-05-08,German CLL Study Group,INTERVENTIONAL,PHASE2,53,Chronic Lymphoid Leukemia
NCT01520558,CNDO-109-AANK for AML in First Complete Remission (CR1),A Phase 1/2 Study of CNDO-109-Activated Allogeneic Natural Killer Cells in Patients With High Risk Acute Myeloid Leukemia in First Complete Remission (CR1),Oncology,UNKNOWN,2012-12,2018-02,"Coronado Biosciences, Inc.",INTERVENTIONAL,"PHASE1, PHASE2",12,Acute Myeloid Leukemia
NCT04359758,Streamlined Genetic Testing in Prostate Cancer,Streamlined Genetic Testing in Prostate Cancer,Oncology,COMPLETED,2020-03-01,2021-11-01,Georgetown University,INTERVENTIONAL,NA,112,Prostate Cancer
NCT03579758,Chemotherapy Before & After Surgery in Patients With Resectable Gallbladder Cancer,"Perioperative Chemotherapy Prior To and After Reoperation for Incidental Gallbladder Cancer - An International, Randomized Phase III Trial",Oncology,WITHDRAWN,2019-04-03,2020-06-01,Emory University,INTERVENTIONAL,PHASE3,0,"Stage I Gallbladder Cancer AJCC v8, Stage II Gallbladder Cancer AJCC v8, Stage IIA Gallbladder Cancer AJCC v8, Stage IIB Gallbladder Cancer AJCC v8, Stage III Gallbladder Cancer AJCC v8, Stage IIIA Gallbladder Cancer AJCC v8, Stage IIIB Gallbladder Cancer AJCC v8"
NCT05092048,A Study for PRO of CML in Real Word,Validation Value of the Questionnaire to Assess Health-related Quality of Life in Patients With CML,Oncology,UNKNOWN,2021-09-22,2022-10-01,xuna,OBSERVATIONAL,N/A,10000,CML (Chronic Myelogenous Leukemia)
NCT00006455,Combination Chemotherapy in Treating Children With Anaplastic Large Cell Lymphoma (ALCL 99),International Protocol for the Treatment of Childhood Anaplastic Large Cell Lymphoma,Oncology,COMPLETED,1999-11-26,2020-09-03,"Gustave Roussy, Cancer Campus, Grand Paris",INTERVENTIONAL,PHASE3,885,Lymphoma
NCT04374448,Utility of Indocyanine Green Fluorescence in Endoscopic Sinonasal and Skull Base Surgery,The Utility of Indocyanine Green Fluorescence in Endoscopic Sinonasal and Skull Base Surgery - A Prospective Case-Series and Feasibility Study,Oncology,UNKNOWN,2023-01-01,2024-01-01,St. Paul's Sinus Centre,INTERVENTIONAL,NA,40,"Chronic Sinusitis, Tumor of Nasal Sinus, Posterior Epistaxis, Skull Base Neoplasms"
NCT00687648,"Cyclophosphamide, Methotrexate, and Prednisolone With or Without Aromatase Inhibitor Therapy in Treating Postmenopausal Women With Metastatic Breast Cancer","Randomised Phase II Study of Metronomic Chemotherapy Plus the Same Aromatase Inhibitor Compared to Metronomic Chemotherapy Alone in Women With Hormone Receptor Positive, Her-2 Non-Overexpressing Advanced Breast Cancer Whose Disease Has Progressed While Receiving an Aromatase Inhibitor, Correlating Response With Circulating Endothelial Progenitor Cells, VEGF and VEGFR",Oncology,UNKNOWN,2008-05,,"National Cancer Centre, Singapore",INTERVENTIONAL,PHASE2,70,Breast Cancer
NCT00403065,Dexamethasone and Supportive Care With or Without Whole-Brain Radiation Therapy in Treating Patients With Non-Small Cell Lung Cancer That Has Spread to the Brain and Cannot Be Removed By Surgery,Quality of Life After Radiotherapy & Steroids. A Phase III Multi-Centre Randomised Controlled Trial to Assess Whether Optimal Supportive Care Alone (Including Dexamathasone) is As Effective as Optimal Supportive Care (Including Dexamethasone ) Plus Whole Brain Radiotherapy in the Treatment of Patients With Inoperable Brain Metastases From Non-Small Cell Lung Cancer,Oncology,COMPLETED,2006-10,2013-03,Medical Research Council,INTERVENTIONAL,PHASE3,1000,"Lung Cancer, Metastatic Cancer"
NCT05031065,Prognostic Indicators for Radiation-induced Breast Fibrosis,Identifying Prognostic Indicators for the Development of Radiation-induced Breast Fibrosis,Oncology,TERMINATED,2024-01-24,2025-05-05,AHS Cancer Control Alberta,OBSERVATIONAL,N/A,4,Breast Cancer
NCT03131765,Dose Escalation and Cohort Expansion Study of YS-ON-001 in Patients With Advanced Solid Tumors,"Phase 1, Open Label, Dose Escalation and Cohort Expansion Study of YS-ON-001 in Patients With Advanced Solid Tumors",Oncology,COMPLETED,2017-04-20,2019-12-16,Yisheng Biopharma (Singapore) Pte. Ltd.,INTERVENTIONAL,PHASE1,31,Cancer
NCT01136265,PET/CT and Sentinel Node in Oral Cancer,Dual-time PET/CT and Sentinel Node Diagnostics Preoperatively in Patients With Oral Cancer,Oncology,UNKNOWN,2010-06,2013-06,"Rigshospitalet, Denmark",OBSERVATIONAL,N/A,70,Oral Cancer
NCT02551965,Nursing Follow up in Geriatric Oncology : Tracking Time of Caregiver Exhaustion Risk,Nursing Follow up in Geriatric Oncology : Tracking Time of Caregiver Exhaustion Risk,Oncology,UNKNOWN,2016-01,2023-09,"University Hospital, Strasbourg, France",INTERVENTIONAL,NA,200,"Exhaustion, Geriatric Disorder"
NCT01427400,The Use of Botulinum Toxin A in Two-Stage Tissue Expander/ Implant Breast Reconstruction,"The Use of Botulinum Toxin-A in Two-stage Tissue Expander/Implant Breast Reconstruction: A Prospective, Randomized, Double-Blind Placebo Controlled Trial",Oncology,UNKNOWN,2011-10,2017-12,University of British Columbia,INTERVENTIONAL,PHASE4,128,"Breast Neoplasms, Neoplasms by Site, Neoplasms, Breast Diseases, Skin Diseases"
NCT00959400,Efficacy and Safety Study of Fentanyl Transdermal (Fentanest®),,Oncology,WITHDRAWN,2009-11,,Cristália Produtos Químicos Farmacêuticos Ltda.,INTERVENTIONAL,PHASE3,0,"Pain, Palliative Care"
NCT04150900,1922GCCC: Pembro and Bavituximab for Squamous Cell Carcinoma of Head and Neck,1922GCCC: PHASE 2 STUDY OF PEMBROLIZUMAB AND BAVITUXIMAB FOR PROGRESSIVE RECURRENT/METASTATIC SQUAMOUS CELL CARCINOMA OF THE HEAD AND NECK,Oncology,ACTIVE_NOT_RECRUITING,2020-01-13,2027-01-01,"University of Maryland, Baltimore",INTERVENTIONAL,PHASE2,7,Squamous Cell Carcinoma
NCT02747992,Paravertebral Block (PVB) Combined Pectoral Musculature Blocks for Modified Radical Mastectomy (MRM),Comparisons the Analgesia of Paravertebral Block Combined With Thoracic Wall Block Versus Paravertebral Block Alone for Modified Radical Mastectomy in Breast Cancer,Oncology,COMPLETED,2015-10,,Sun Yat-sen University,OBSERVATIONAL,N/A,100,"Mastectomy, Modified Radical"
NCT05342792,Metronomic Capecitabine With or Without PD-1 Antibody as Adjuvant Therapy in High-risk Nasopharyngeal Carcinoma,"Metronomic Capecitabine With or Without Tislelizuamb (PD-1 Antibody) as Adjuvant Therapy in High-risk Non-metastatic Nasopharyngeal Carcinoma: a Multicentre, Open-label, Randomised Phase 3 Trial",Oncology,RECRUITING,2022-04-17,2029-06,Sun Yat-sen University,INTERVENTIONAL,PHASE3,556,Nasopharyngeal Carcinoma
NCT01741792,Clinical Study With Blinatumomab in Patients With Relapsed/Refractory Diffuse Large B-cell Lymphoma (DLBCL),"An Open Label, Multicenter, Exploratory Phase 2 Study to Evaluate the Efficacy and Safety of the Bispecific T-Cell Engager (BiTE®) Blinatumomab in Patients With Relapsed/Refractory Diffuse Large B-Cell Lymphoma (DLBCL)",Oncology,COMPLETED,2012-07,2015-09,Amgen Research (Munich) GmbH,INTERVENTIONAL,PHASE2,25,Diffuse Large B-cell Lymphoma
NCT02357836,Neoadjuvant Itraconazole in Non-small Cell Lung Cancer,Phase 0 Pharmacodynamic Study of the Effects of Itraconazole on Tumor Angiogenesis and the Hedgehog Pathway in Early-stage Non-small Cell Lung Cancer,Oncology,COMPLETED,2015-06,2018-07,University of Texas Southwestern Medical Center,INTERVENTIONAL,EARLY_PHASE1,13,Non-small Cell Lung Cancer
NCT05694871,Testing the Addition of Cemiplimab to Palbociclib for the Treatment of Advanced Dedifferentiated Liposarcoma,Official Title A Randomized Phase 2 Trial With a Safety Lead-In to Evaluate Palbociclib Versus Palbociclib and Cemiplimab for the Treatment of Advanced Dedifferentiated Liposarcoma,Oncology,ACTIVE_NOT_RECRUITING,2023-06-07,2027-05-31,Alliance for Clinical Trials in Oncology,INTERVENTIONAL,PHASE2,77,"Advanced Dedifferentiated Liposarcoma, Locally Advanced Dedifferentiated Liposarcoma, Metastatic Dedifferentiated Liposarcoma, Stage III Soft Tissue Sarcoma of the Trunk and Extremities AJCC v8, Stage IV Soft Tissue Sarcoma of the Trunk and Extremities AJCC v8, Unresectable Dedifferentiated Liposarcoma"
