nct_id,brief_title,official_title,category,status,start_date,completion_date,sponsor,study_type,phase,enrollment,conditions
NCT03084692,Therapeutic Yoga and Resistance Exercise for Lung Cancer,Feasibility and Preliminary Efficacy of a Combined Therapeutic Yoga and Resistance Exercise Intervention for Individuals With Lung Cancer and Their Caregivers,Oncology,COMPLETED,2017-04-14,2018-05-31,University of Alberta,INTERVENTIONAL,NA,23,Lung Cancer
NCT04209192,Antimicrobial Prophylaxis in Patients Who Underwent a Transurethral Resection of Bladder (TURB),Randomized Phase II Study of Antibiotic Prophylaxis With Fosfomycin vs Amikacin in Transurethral Resection of Bladder,Oncology,COMPLETED,2020-01-01,2023-04-01,Instituto Nacional de Ciencias Medicas y Nutricion Salvador Zubiran,INTERVENTIONAL,PHASE2,75,"Urinary Tract Infections, Bladder Cancer, Urologic Surgical Procedures"
NCT03269136,PF-06863135 As Single Agent And In Combination With Immunomodulatory Agents In Relapse/Refractory Multiple Myeloma,"MAGNETISMM-1 A PHASE I, OPEN LABEL STUDY TO EVALUATE THE SAFETY, PHARMACOKINETIC, PHARMACODYNAMIC AND CLINICAL ACTIVITY OF ELRANATAMAB (PF-06863135), A B-CELL MATURATION ANTIGEN (BCMA) - CD3 BISPECIFIC ANTIBODY, AS A SINGLE AGENT AND IN COMBINATION WITH IMMUNOMODULATORY AGENTS IN PATIENTS WITH RELAPSED/REFRACTORY ADVANCED MULTIPLE MYELOMA (MM)",Oncology,COMPLETED,2017-11-29,2024-01-19,Pfizer,INTERVENTIONAL,PHASE1,101,Multiple Myeloma
NCT01842971,ALPPS (Liver Partition and Portal Vein Ligation) for Two-stage Hepatectomy for Colorectal Liver Metastasis,Associating Liver Partition and Portal Vein Ligation (ALPPS) for Potentially Resectable Liver Metastasis From Colorectal Cancer: Prospective Evaluation of the Early Two-stage Hepatectomy by the Simon's Methods,Oncology,TERMINATED,2013-06-07,2016-12-13,"Centre Hospitalier Universitaire, Amiens",INTERVENTIONAL,PHASE3,3,Colorectal Cancer
NCT02734771,"A Study of Brentuximab Vedotin, Rituximab, and Dose Attenuated CHP in Elderly Patients With Diffuse Large B-Cell Lymphoma (DLBCL)","Phase II Pilot Study of Brentuximab Vedotin, Rituximab and Dose Attenuated CHP in Elderly Patients With DLBCL",Oncology,ACTIVE_NOT_RECRUITING,2016-06,2025-12,Patrick Reagan,INTERVENTIONAL,PHASE2,24,Diffuse Large B-Cell Lymphoma
NCT00493571,Phase I Study of Gimatecan in Patients With Myelodysplastic Syndromes,Phase I Study of Gimatecan in Patients With Myelodysplastic Syndromes,Oncology,COMPLETED,2007-08,2014-05,M.D. Anderson Cancer Center,INTERVENTIONAL,PHASE1,16,"Myelodysplastic Syndromes, MDS"
NCT00191971,2nd Line Gemcitabine Monotherapy for Transitional Cell Carcinoma of Urothelium (TCC) After CDDP Regimen,A Phase II Study of Gemcitabine in Transitional Cell Carcinoma of the Urothelium,Oncology,COMPLETED,2004-01,2006-09,Eli Lilly and Company,INTERVENTIONAL,PHASE2,40,"Urologic Neoplasms, Carcinoma, Transitional Cell"
NCT05887011,CRT( Chemo-Radiation Therapy) Patterns and Short-term Outcomes on Unresectable NSCLC and SCLC in Routine Practices in Russia,National Multicentre Non-interventional Study to Assess CRT Patterns and Short-term Outcomes on Unresectable NSCLC and SCLC in Routine Practices in Russia,Oncology,ACTIVE_NOT_RECRUITING,2023-03-31,2026-06-30,AstraZeneca,OBSERVATIONAL,N/A,2000,Unresectable /Inoperable Locally Advanced (Stage II-III) NSCLC and Locally Advanced LS-SCLC (Stage I-III)
NCT04639271,"Pyrotinib, Trastuzumab And Abraxane in HER2-positive MBC With Brain Metastasis","A Single-arm, Open-label Study Of Pyrotinib Combined WithTrastuzumab And Abraxane in Patients With Brain Metastases From HER2-positive Metastatic Breast Cancer",Oncology,UNKNOWN,2021-01-01,2022-03-01,Shandong Cancer Hospital and Institute,INTERVENTIONAL,PHASE2,100,"Breast Cancer, HER2-positive Breast Cancer"
NCT00492544,Immunogenicity and Safety of GSK Biologicals' HPV Vaccine 580299 in Healthy Japanese Females 10-15 Years of Age,Evaluation of the Immunogenicity and Safety of GlaxoSmithKline Biologicals' HPV Vaccine 580299 When Administered as a 3-dose Schedule in Healthy Japanese Pre-adolescent and Adolescent Female Subjects.,Oncology,COMPLETED,2007-07-02,2008-03-28,GlaxoSmithKline,INTERVENTIONAL,PHASE3,100,"Infections, Papillomavirus"
NCT00866944,Study of Adecatumumab Relative to FOLFOX After R0 Resection of Colorectal Liver Metastases,"A Randomized, Open-label, Controlled, Multi-center Phase II Study to Evaluate the Efficacy and Safety of Adecatumumab Alone or Sequentially to FOLFOX Relative to FOLFOX After R0 Resection of Colorectal Liver Metastases",Oncology,COMPLETED,2009-03,2011-11,Amgen Research (Munich) GmbH,INTERVENTIONAL,PHASE2,35,"Liver Metastases, Colorectal Cancer"
NCT01262144,SUV Max as Predictor of Outcome in Cervical Cancer,A Study to Evaluate the Value of SUV-Max in PET-FDG in Predicting Outcome of Surgery Vis a Vis Need for Radiotherapy,Oncology,COMPLETED,2010-08,,Rambam Health Care Campus,OBSERVATIONAL,N/A,50,Cervical Cancer
NCT02793544,HLA-Mismatched Unrelated Donor Bone Marrow Transplantation With Post-Transplantation Cyclophosphamide,"A Multi-Center, Phase II Trial of HLA-Mismatched Unrelated Donor Bone Marrow Transplantation With Post-Transplantation Cyclophosphamide for Patients With Hematologic Malignancies",Oncology,COMPLETED,2016-12,2020-03,Center for International Blood and Marrow Transplant Research,INTERVENTIONAL,PHASE2,80,"Myelodysplastic Syndrome (MDS), Chronic Lymphocytic Leukemia (CLL), Chemotherapy-sensitive Lymphoma, Acute Lymphoblastic Leukemia (ALL)/T Lymphoblastic Lymphoma, Acute Myelogenous Leukemia (AML), Acute Biphenotypic Leukemia (ABL), Acute Undifferentiated Leukemia (AUL)"
NCT03490344,Short Course Daratumumab in Patients With Multiple Myeloma,Short Course Daratumumab in Minimal Residual Disease (MRD) Positive Myeloma Patients After Induction Therapy With/Without Consolidative High Dose Chemotherapy/Autologous Stem Cell Support,Oncology,COMPLETED,2018-05-03,2023-03-23,Memorial Sloan Kettering Cancer Center,INTERVENTIONAL,PHASE2,10,Multiple Myeloma
NCT02402244,Project: Every Child for Younger Patients With Cancer,"The Project: EveryChild Protocol: A Registry, Eligibility Screening, Biology and Outcome Study",Oncology,RECRUITING,2015-11-03,2030-12-31,Children's Oncology Group,OBSERVATIONAL,N/A,75000,"Adrenal Gland Pheochromocytoma, Carcinoma In Situ, Central Nervous System Neoplasm, Childhood Immature Teratoma, Childhood Kidney Neoplasm, Childhood Langerhans Cell Histiocytosis, Childhood Mature Teratoma, Congenital Mesoblastic Nephroma, Desmoid Fibromatosis, Ganglioneuroma, Lymphoproliferative Disorder, Malignant Neoplasm, Malignant Solid Neoplasm, Melanocytic Neoplasm, Myeloproliferative Neoplasm, Neoplasm of Uncertain Malignant Potential, Neuroendocrine Neoplasm, Stromal Neoplasm"
NCT04683744,Facilitators and Barriers to Cancer Screening: Stakeholder Perspectives on Implementation,Facilitators and Barriers to Cancer Screening: Stakeholder Perspectives on Implementation,Oncology,COMPLETED,2021-01-11,2023-07-31,Indiana University,OBSERVATIONAL,N/A,82,Colorectal Cancer Screening
NCT07310134,"Study to Evaluate Safety, Tolerability, Pharmacokinetics, Pharmacodynamics and Efficacy of ZX-8177 in Patients With Advanced Solid Tumors","An Open-Label, Multicenter Phase I Clinical Study on the Safety, Tolerability, Pharmacokinetics, Pharmacodynamics, and Efficacy of Dose Escalation and Dose Expansion of ZX-8177 Tablets in Chinese Patients With Advanced Solid Tumors",Oncology,RECRUITING,2025-12-26,2026-12-30,Nanjing Zenshine Pharmaceuticals,INTERVENTIONAL,PHASE1,80,Advanced Solid Tumors
NCT01530334,Iressa Re-Challenge in Advanced NSCLC EGFR M+ Patients Who Responded to Gefitinib USed as 1st Line or Previous Treatment,"A Phase II Open Label, Multicentre, Single Arm Study to Characterise the Efficacy, Safety and Tolerability of Gefitinib 250 mg (IRESSA) as 3rd Line Treatment Re-challenge in Patients, Who Have Epidermal Growth Factor Receptor (EGFR) Mutation Positive Locally Advanced or Metastatic Non-Small Cell Lung Cancer (NSCLC) and Who Responded to Gefitinib in 1st Line and Progressed After 2nd Line Chemotherapy",Oncology,COMPLETED,2012-07,2014-07,AstraZeneca,INTERVENTIONAL,PHASE2,61,Lung Cancer
NCT01732432,Endometriosis and Frequency of Endometriosis-associated Ovarian Carcinomas (EAOC),Endometriosis and Frequency of Endometriosis-associated Ovarian Carcinomas (EAOC) - Epidemiological and Molecular Pathological Aspects,Oncology,WITHDRAWN,2012-10,2013-12,"University Hospital, Basel, Switzerland",OBSERVATIONAL,N/A,0,"Endometrioid Carcinoma, Clear Cell Carcinoma, Endometriosis"
NCT02239432,Telomere Biology in Early Adenocarcinoma of the Lung,Prospective Cohort Study of Telomere Biology Among Patients With Early Adenocarcinoma of the Lung,Oncology,UNKNOWN,2014-09,2017-09,Meir Medical Center,OBSERVATIONAL,N/A,100,"Adenocarcinoma of the Lung, Adenocarcinoma, Bronchiolo-Alveolar"
NCT04578132,Description of the Population With Genitourinary Tumors and COVID-19,Observational Retrospective-prospective Study in Patients With Genitourinary Tumors Presenting COVID-19 Infection (SOGUG-COVID-19),Oncology,COMPLETED,2020-12-18,2022-11-23,Spanish Oncology Genito-Urinary Group,OBSERVATIONAL,N/A,410,"Covid19, Genito Urinary Cancer"
NCT06269198,Postoperative Complications in Cancer Patients Monitored With Intelligent Continuous Monitoring System,Postoperative Complications in Cancer Patients Monitored With Intelligent Continuous Monitoring System Versus Standard of Care - a Randomized Clinical Trial,Oncology,RECRUITING,2023-10-31,2027-04-01,"Rigshospitalet, Denmark",INTERVENTIONAL,NA,504,"Postoperative Complications, Cancer, Treatment-Related"
NCT05649163,Real-world Study of HER2-overexpressed Advanced Solid Tumors After Progression of First-line Standard Therapy,"A Non-interventional, Multi-cohort, Multi-center, Prospective Real-world Study of Treatment Pattern and Clinical Outcomes in Patients With HER2-overexpressed Advanced Solid Tumors After Progression of First-line Standard Therapy",Oncology,UNKNOWN,2023-01,2025-05,Shen Lin,OBSERVATIONAL,N/A,306,"HER2, Advanced Gastric Cancer, Advanced Gastroesophageal Junction Adenocarcinoma, Advanced Solid Tumor"
NCT02659293,"Trial of Carfilzomib, Lenalidomide, Dexamethasone Versus Lenalidomide Alone After Stem-cell Transplant for Multiple Myeloma","Phase 3 Randomized Trial of Carfilzomib, Lenalidomide, Dexamethasone Versus Lenalidomide Alone After Stem-cell Transplant for Multiple Myeloma",Oncology,ACTIVE_NOT_RECRUITING,2016-04-26,2027-11,University of Chicago,INTERVENTIONAL,PHASE3,180,Multiple Myeloma
NCT04481893,Interest of the Virtual Reality Headset in the Management of Perioperative Stress in Patients Candidates for Total Thyroidectomy,Interest of the Virtual Reality Headset in the Management of Perioperative Stress in Patients Candidates for Total Thyroidectomy,Oncology,COMPLETED,2020-11-18,2025-06-06,Centre Francois Baclesse,INTERVENTIONAL,NA,82,"Thyroid Cancer, Thyroidectomy"
NCT06645093,Feasibility of Intermittent Fasting During Chemotherapy,Intermittent Fasting During Curatively Intended Chemotherapy for Malignant Lymphoma - a Randomized Feasibility Trial,Oncology,ENROLLING_BY_INVITATION,2024-10-31,2026-12,University of Oslo,INTERVENTIONAL,NA,40,"Lymphoma, Cancer, Fasting"
NCT02468193,Study of Efficacy and Safety of Osilodrostat in Cushing's Syndrome,"A Phase II, Open-label, Dose Titration, Multi-center Study to Assess the Safety/Tolerability and Efficacy of Osilodrostat in Patients With All Types of Endogenous Cushing's Syndrome Except Cushing's Disease",Oncology,COMPLETED,2015-09-24,2018-10-29,Novartis Pharmaceuticals,INTERVENTIONAL,PHASE2,9,"Cushing's Syndrome, Ectopic Corticotropin Syndrome, Adrenal Adenoma, Adrenal Carcinoma, AIMAH, PPNAD"
NCT05894421,TQB2223 Injection in Combination With Penpulimab in Patients With Advanced Cancers,Phase I Clinical Trial to Evaluate the Tolerability and Pharmacokinetics of TQB2223 Injection Combined With Penpulimab Injection in Subjects With Advanced Cancers,Oncology,UNKNOWN,2023-06-06,2026-01,"Chia Tai Tianqing Pharmaceutical Group Co., Ltd.",INTERVENTIONAL,PHASE1,92,Advanced Cancer
NCT00708214,BIBW 2992 and Letrozole in Hormonoresistant Metastatic Breast Cancer,A Phase II Study of BIBW 2992 Administration in Patients With Hormone Refractory Metastatic Breast Cancer,Oncology,COMPLETED,2007-01,,Boehringer Ingelheim,INTERVENTIONAL,PHASE2,28,Breast Neoplasms
NCT04909814,Colposcopic Impression in a Birth Cohort Previously Eligible for HPV-vaccination,Colposcopic Impression in a Birth Cohort Previously Eligible for HPV-vaccination,Oncology,COMPLETED,2018-03-14,2019-12-31,Falu Hospital,OBSERVATIONAL,N/A,160,"HPV, Cervical Cancer"
NCT03678714,Effect of Exercise on Cardiometabolic Profile in Women With Polycystic Ovary Syndrome,Effects of Exercise on Oxidised LDL and Cardiometabolic Profile in Women With Polycystic Ovary Syndrome: Study Protocol for a Feasibility Randomized-controlled Trial,Oncology,COMPLETED,2018-10-01,2020-05-30,Sheffield Hallam University,INTERVENTIONAL,NA,37,Polycystic Ovary Syndrome
NCT01484314,Eltrombopag for Thrombocytopenia in Patients With Relapsed Multiple Myeloma,A Phase II Study of Eltrombopag for the Treatment of Thrombocytopenia in Patients Undergoing Therapy for Relapsed Multiple Myeloma,Oncology,TERMINATED,2012-04,2015-09,Dana-Farber Cancer Institute,INTERVENTIONAL,PHASE2,1,"Thrombocytopenia, Multiple Myeloma"
NCT00563316,Effect of Panitumumab on the Pharmacokinetics of Irinotecan,"A Phase I, Open-label Study to Determine the Effect of Panitumumab on the Pharmacokinetics of Irinotecan in Subjects With Unresectable Metastatic Colorectal Cancer",Oncology,COMPLETED,2008-03,2010-06,Amgen,INTERVENTIONAL,PHASE1,28,Metastatic Colorectal Cancer
NCT03775616,Financial Navigation Program Intervention in Supporting Patients With Solid Tumors and Their Caregivers,Development of a Comprehensive Financial Navigation Program for Patients With Cancer and Their Caregivers,Oncology,COMPLETED,2017-11-15,2019-05-15,Fred Hutchinson Cancer Center,INTERVENTIONAL,NA,30,"Caregiver, Solid Neoplasm"
NCT03068416,"CD19-targeting, 3rd Generation CAR T Cells for Refractory B Cells Malignancy","CD19-targeting, 3rd Generation CAR T Cells for Refractory B Cells Malignancy - a Phase II Trial.",Oncology,COMPLETED,2017-09-18,2021-08-19,Uppsala University,INTERVENTIONAL,PHASE2,24,"B-cell Leukemia, B-Cell Lymphoma"
NCT05407506,Clinical Study of Ultrasonic Artificial Intelligence and Fine Needle Aspiration in Qualitative Diagnosis of Thyroid Nodules,Clinical Study of Ultrasonic Artificial Intelligence and Fine Needle Aspiration in Qualitative Diagnosis of Thyroid Nodules,Oncology,UNKNOWN,2022-06,2024-06,Luo Dingcun,INTERVENTIONAL,NA,1000,Thyroid Nodule
NCT05763004,"A Clinical Study to Evaluate the Safety, Tolerability and Efficacy of IOS-1002 Administered Alone and in Combination With Pembrolizumab, a PD-1 Monoclonal Antibody in Advanced Solid Tumors","A Phase 1a/1b, First-in-human, Open-label, Non-randomized, Multicenter, Dose Escalation and Cohort Expansion Study to Evaluate the Safety, Tolerability, Efficacy, Immunogenicity, Pharmacokinetics, and Pharmacodynamics of IOS 1002 Administered Alone and in Combination With Pembrolizumab, a PD-1 Monoclonal Antibody in Advanced Solid Tumors",Oncology,ACTIVE_NOT_RECRUITING,2023-03-15,2026-07,ImmunOs Therapeutics AG,INTERVENTIONAL,PHASE1,140,"Solid Tumor, Adult"
NCT07187284,"EDN Combined With TACE/HAIC and Second-Line Immune-Targeted Treatment Versus TACE/HAIC Alone in Locally Advanced HCC With Portal Vein Tumor Thrombosis After First-Line Therapy Failure: A Prospective, Multicenter, Randomized Controlled Trial","Evaluating Endervascular Denervation (EDN) Combined With Transarterial Intervention (TACE/HAIC) and Second-Line Immune-Targeted Therapy in Locally Advanced Hepatocellular Carcinoma (HCC) With Portal Vein Tumor Thrombosis After Progression on First-Line Systemic Therapy: A Prospective, Multicenter, Randomized Controlled Study",Oncology,NOT_YET_RECRUITING,2025-09-30,2027-09-30,Zhongda Hospital,INTERVENTIONAL,"PHASE1, PHASE2",62,HCC - Hepatocellular Carcinoma
NCT00875004,Epoetin Beta in Patients Undergoing Chemotherapy for Solid Tumors,Research Factors Predictive of Treatment Failure With Erythropoietin Beta (NeoRecormon®) in Patients With Solid Tumors Treated With Chemotherapy,Oncology,TERMINATED,2007-12-07,2011-12-31,Institut du Cancer de Montpellier - Val d'Aurelle,INTERVENTIONAL,NA,27,"Anemia, Unspecified Adult Solid Tumor, Protocol Specific"
NCT03796884,Linaclotide in Treating Patients With Stages 0-3 Colorectal Cancer,"Phase II Randomized, Placebo-Controlled Trial of Linaclotide to Demonstrate Bioactivity in Patients With Sporadic Colorectal Adenomas and With Colorectal Cancer",Oncology,ACTIVE_NOT_RECRUITING,2019-10-30,2026-06-30,Sidney Kimmel Comprehensive Cancer Center at Thomas Jefferson University,INTERVENTIONAL,PHASE2,230,"Colorectal Adenoma, Stage 0 Colorectal Cancer AJCC v8, Stage I Colorectal Cancer AJCC v8, Stage II Colorectal Cancer AJCC v8, Stage IIA Colorectal Cancer AJCC v8, Stage IIB Colorectal Cancer AJCC v8, Stage IIC Colorectal Cancer AJCC v8, Stage III Colorectal Cancer AJCC v8, Stage IIIA Colorectal Cancer AJCC v8, Stage IIIB Colorectal Cancer AJCC v8, Stage IIIC Colorectal Cancer AJCC v8"
NCT00620633,Dose Escalation Trial of WT1-Sensitized T Cells for Residual or Relapsed Leukemia After Allogeneic Hematopoietic Progenitor Cell Transplantation,A Phase I Dose Escalation Trial of WT1-Sensitized T Cells for Residual or Relapsed Leukemia After Allogeneic Hematopoietic Progenitor Cell Transplantation,Oncology,COMPLETED,2008-02-08,2021-02-26,Memorial Sloan Kettering Cancer Center,INTERVENTIONAL,PHASE1,22,"Leukemia, Myelodysplastic Syndrome"
NCT05918133,A Study of PM8002 Plus Nab-paclitaxel as First Line Therapy for TNBC,"A Phase Ib/II Study of PM8002 Injection Plus Nab-paclitaxel as First Line Therapy for Unresectable, Locally Advanced or Metastatic Triple-negative Breast Cancer",Oncology,ACTIVE_NOT_RECRUITING,2022-07-01,2026-10-30,Biotheus Inc.,INTERVENTIONAL,"PHASE1, PHASE2",42,TNBC
NCT03361852,Personalized Neoantigen Cancer Vaccine + Pembrolizumab After Rituximab for Follicular Lymphoma,A Pilot Study of a Personalized Neoantigen Cancer Vaccine in Combination With Pembrolizumab Following Front-Line Rituximab in Follicular Lymphoma,Oncology,ACTIVE_NOT_RECRUITING,2022-03-14,2033-12-26,Dana-Farber Cancer Institute,INTERVENTIONAL,PHASE1,20,Follicular Lymphoma
NCT05769452,"Closed Intravenous Catheter System on Catheter Success, Length of Stay and Complications","Effect of Closed Intravenous Catheter System on Catheter Success, Length of Stay and Complications in Pediatric Hematology and Oncology Patients",Oncology,COMPLETED,2022-04-01,2022-11-30,Gülçin Özalp Gerçeker,INTERVENTIONAL,NA,214,"Catheter Complications, Catheter Leakage"
NCT00719147,AVN of Weight-Bearing Joints In Patients With Hematologic Malignancies Treated With Dexamethasone Or Prednisone,Avascular Necrosis of Weight-Bearing Joints In Patients With Hematologic Malignancies Treated With Dexamethasone Or Prednisone,Oncology,COMPLETED,2001-07,2005-07,St. Jude Children's Research Hospital,OBSERVATIONAL,N/A,170,"Avascular Necrosis, Acute Lymphoblastic Leukemia"
NCT01865747,A Study of Cabozantinib (XL184) vs Everolimus in Subjects With Metastatic Renal Cell Carcinoma,"A Phase 3, Randomized, Controlled Study of Cabozantinib (XL184) vs Everolimus in Subjects With Metastatic Renal Cell Carcinoma That Has Progressed After Prior VEGFR Tyrosine Kinase Inhibitor Therapy",Oncology,COMPLETED,2013-06,2021-01-15,Exelixis,INTERVENTIONAL,PHASE3,658,Renal Cell Carcinoma
NCT01941849,Phase I Trial of Vandetanib Combined With 131I-mIBG to Treat Patients With Advanced Phaeochromocytoma and Paraganglioma,"A Phase I Trial of Vandetanib Combined With 131I-mIBG Radiotherapy in Patients With Neuroendocrine Tumours, Advanced Phaeochromocytoma and Paraganglioma",Oncology,WITHDRAWN,2014-10,2015-12,"University College, London",INTERVENTIONAL,PHASE1,0,"Phaeochromocytoma, Paraganglioma"
NCT07191249,"A Phase 2, Multicenter, Open-Label Trial to Evaluate Efficacy and Safety of Subcutaneous (SC) Mosunetuzumab in Previously Untreated Low Tumor Burden Follicular Lymphoma (LTB-FL).","A Phase 2, Multicenter, Open-Label Trial to Evaluate Efficacy and Safety of Subcutaneous (SC) Mosunetuzumab in Previously Untreated Low Tumor Burden Follicular Lymphoma (LTB-FL).",Oncology,NOT_YET_RECRUITING,2025-10-10,2029-03-01,Tel-Aviv Sourasky Medical Center,INTERVENTIONAL,PHASE2,30,Follicular Lymphoma
NCT01017549,Post Market Study Using the Xoft Axxent System,"Post Market Clinical Study to Evaluate the Safety and Performance of the Axxent® Electronic Brachytherapy System in Women With Resected, Early Stage Breast Cancer",Oncology,COMPLETED,2007-03-26,2016-05-07,"Xoft, Inc.",INTERVENTIONAL,NA,44,Breast Cancer
NCT07059949,Short Course Radiotherapy Followed by CAPOX and Carrilizumab and Bevacizumab or Cetuximab for the Initial Treatment of Unresectable Metastatic Rectal Cancer,"Phase II, Single-center Study of Short-course Radiotherapy Followed by CAPOX and Carrelizumab and Bevacizumab or Cetuximab in the Treatment of Initially Unresectable Metastatic Rectal Cancer",Oncology,NOT_YET_RECRUITING,2025-06-30,2027-06-30,"Union Hospital, Tongji Medical College, Huazhong University of Science and Technology",INTERVENTIONAL,PHASE2,80,"Unresectable Metastatic Rectal Cancer, CAPOX, Combination of Radioimmunotherapy"
NCT05519449,Study of JANX007 in Subjects With Metastatic Castration-Resistant Prostate Cancer (ENGAGER-PSMA-01),"A Phase 1, Open-Label, Multicenter Study of JANX007 in Subjects With Metastatic Castration-Resistant Prostate Cancer",Oncology,RECRUITING,2022-09-15,2028-12,Janux Therapeutics,INTERVENTIONAL,PHASE1,272,"Prostate Cancer, Metastatic Castration-resistant Prostate Cancer, Castration Resistant Prostatic Cancer"
NCT01003938,Topotecan With Erlotinib for Topotecan Pretreated Ovarian Cancer,Continuous Infusion Topotecan With Erlotinib for Topotecan Pretreated Ovarian Cancer: Tumor Features and Phase II/Pharmacokinetic Evaluation,Oncology,TERMINATED,2009-08,2012-12,NYU Langone Health,INTERVENTIONAL,PHASE2,6,Ovarian Cancer
NCT02636738,Vela China Study: in Cutting And Hemostasis For Gastrointestinal Epithelial Neoplasia In Chinese Population,"A Prospective, Multicenter, Single-arm, Non-controlled Study to Evaluate The Safety and Utility of VelaTM XL Thulium Laser in Cutting And Hemostasis For Gastrointestinal Epithelial Neoplasia In Chinese Population",Oncology,TERMINATED,2016-06-06,2018-04-01,Boston Scientific Corporation,INTERVENTIONAL,NA,2,Indication for Modification of Patient Physical Status
NCT01271738,Evaluating and Comparing Two Surgical Methods for Treatment of Early Stage Breast Cancer,"Measuring the Effect of Additional Tumor Cavity Margins Excision at the Time of Breast Conserving Surgery for Stage 0, I, II, and III Breast Cancer Patients on Re-excision Rate, Cosmetic Results and Total Costs",Oncology,COMPLETED,2009-09,2015-02,Emory University,INTERVENTIONAL,NA,79,"Breast Neoplasms, Breast Cancer, Breast Tumors, Cancer of Breast, Cancer of the Breast, Human Mammary Carcinoma, Neoplasms, Breast"
NCT07089758,A Study for Cerebral Open Flow Microperfusion,A Pilot Feasibility Study for Cerebral Open Flow Microperfusion in Patients Undergoing Planned Neurosurgical Resection of Diseased Parenchyma.,Oncology,NOT_YET_RECRUITING,2026-10,2028-10,Mayo Clinic,INTERVENTIONAL,NA,6,"Glioma, Glioblastoma"
NCT03380858,REINFORCEMENT ANASTOMOSIS WITH Modified Cyanacrylate IN Patients Undergoing to Oncologic Colorectal Surgery With Colorectal Anastomosis,REINFORCEMENT ANASTOMOSIS IN ONCOLOGIC COLORECTAL SURGERY,Oncology,UNKNOWN,2017-11-02,2019-05-02,"National Cancer Institute, Naples",OBSERVATIONAL,N/A,390,Colorectal Cancer
NCT00596648,A Study of XL184 (Cabozantinib) With or Without Erlotinib in Subjects With Non-Small Cell Lung Cancer (NSCLC),A Phase 1b/2 Study of XL184 With or Without Erlotinib in Subjects With Non-Small Cell Lung Cancer,Oncology,COMPLETED,2008-02-12,2012-08-02,Exelixis,INTERVENTIONAL,"PHASE1, PHASE2",92,"Carcinoma, Non-Small-Cell Lung"
NCT02942355,Trial of Anastrozole and Palbociclib in Metastatic HER2-Negative Breast Cancer,"Pilot Trial of Anastrozole and Palbociclib as First-Line Therapy and as Maintenance Therapy After First Line Chemotherapy in Hormone Receptor Positive, HER2-Negative Postmenopausal Metastatic Breast Cancer",Oncology,ACTIVE_NOT_RECRUITING,2016-12-07,2028-06-30,Wake Forest University Health Sciences,INTERVENTIONAL,PHASE2,40,"Female Breast Carcinoma, Breast Cancer"
NCT04547855,Anlotinib Combined With Dose-dense Temozolomide for the First Recurrent or Progressive Glioblastoma After STUPP Regimen,A Phase II Study of Anlotinib Combined With Dose-dense Temozolomide for the First Recurrent or Progressive Glioblastoma After STUPP Regimen,Oncology,UNKNOWN,2020-09-11,2023-03-11,Yonggao Mou,INTERVENTIONAL,PHASE2,54,Glioblastoma
NCT05273255,Fecal Microbiota Transplantation in Patients With Malignancies Not Responding to Cancer Immunotherapy,An Open Label Feasibility Study of Fecal Microbiota Transplantation (FMT) in Patients With Malignancies Not Responding to Cancer Immunotherapy (CI),Oncology,COMPLETED,2022-03-14,2024-10-24,Michael Scharl,INTERVENTIONAL,NA,18,"Cancer, Fecal Microbiota Transplantation, Immune Checkpoint Inhibitors, Immunotherapy"
